{
  "$schema": "http://json-schema.org/draft-07/schema#",
  "title": "OpenShift Airgap Architect Parameter Catalog Schema",
  "description": "JSON Schema for parameter catalog files in data/params/<minor>/*.json",
  "enforcement": {
    "executableValidator": "scripts/validate-catalog.js",
    "conformanceTest": "scripts/validate-catalog-schema-conformance.test.js",
    "note": "This schema is NOT executed at validation time. scripts/validate-catalog.js implements the rules in code and is what runs in CI. The conformance test holds the two to each other by importing the validator's exported CONTRACT and comparing it against this file, so the pair can no longer drift silently. Known, reviewed divergences are enumerated in the conformance test's DIVERGENCE_REGISTER, each with a reason and an owning tranche; an unregistered divergence fails the test."
  },
  "version": "2.0.0",
  "changelog": [
    {
      "version": "1.0.0",
      "date": "2026-05-01",
      "changes": "Initial schema with path, outputFile, type, allowed, default, required, description, citations, applies_to"
    },
    {
      "version": "1.1.0",
      "date": "2026-05-26",
      "changes": "Added deprecation support: deprecated, deprecatedReason, replacementPath, removalVersion fields"
    },
    {
      "version": "2.0.0",
      "date": "2026-06-01",
      "changes": "⭐ BREAKING: Added version-awareness support (DOC-101 Phase 1): supportStatus (REQUIRED), minVersion (REQUIRED), maxVersion (REQUIRED), versionNotes (OPTIONAL), validationRules (OPTIONAL). All parameters MUST have these three fields. CI fails on 'unknown-needs-review' status."
    }
  ],
  "type": "object",
  "required": ["scenarioId", "version", "parameters"],
  "properties": {
    "scenarioId": {
      "type": "string",
      "description": "Unique scenario identifier (e.g., 'bare-metal-ipi', 'vsphere-agent')",
      "examples": ["bare-metal-ipi", "vsphere-agent", "aws-govcloud-ipi"]
    },
    "version": {
      "type": "string",
      "description": "OpenShift minor version this catalog covers",
      "pattern": "^4\\.\\d+$",
      "examples": ["4.20", "4.21"]
    },
    "description": {
      "type": "string",
      "description": "Optional human-readable scenario description"
    },
    "parameters": {
      "type": "array",
      "description": "Array of parameter definitions",
      "items": {
        "type": "object",
        "required": ["path", "outputFile", "type", "allowed", "default", "required", "description", "applies_to", "citations", "supportStatus", "minVersion", "maxVersion"],
        "properties": {
          "path": {
            "type": "string",
            "description": "Dot-notation path in YAML structure (e.g., 'baseDomain', 'platform.baremetal.apiVIPs', 'networking.machineNetwork[0].cidr')",
            "examples": [
              "baseDomain",
              "platform.baremetal.apiVIPs",
              "networking.machineNetwork[0].cidr",
              "platform.vsphere.failureDomains[].topology.datacenter"
            ]
          },
          "outputFile": {
            "type": "string",
            "description": "Target YAML file where this parameter is written",
            "enum": ["install-config.yaml", "agent-config.yaml", "imageset-config.yaml"],
            "examples": ["install-config.yaml", "agent-config.yaml"]
          },
          "type": {
            "type": "string",
            "description": "Data type of the parameter value",
            "enum": ["string", "integer", "boolean", "array", "object", "cidr", "ipv4", "ipv6"],
            "examples": ["string", "integer", "boolean", "array"]
          },
          "allowed": {
            "description": "Enum values (array) or free-form description (string). Empty array if no enum constraint.",
            "oneOf": [
              {
                "type": "array",
                "items": { "type": "string" },
                "description": "Array of allowed enum values"
              },
              {
                "type": "string",
                "description": "Free-form description of allowed values when not strict enum"
              }
            ],
            "examples": [
              ["OVNKubernetes", "OpenShiftSDN"],
              "Array of channel objects with name, minVersion, maxVersion",
              []
            ]
          },
          "default": {
            "description": "Default value if not provided by user. Null if no default.",
            "oneOf": [
              { "type": "string" },
              { "type": "number" },
              { "type": "boolean" },
              { "type": "null" }
            ],
            "examples": ["OVNKubernetes", 443, true, null]
          },
          "required": {
            "type": "boolean",
            "description": "Whether parameter is required for the scenario. Conditional requirements should be false with conditions noted in description."
          },
          "description": {
            "type": "string",
            "description": "Comprehensive parameter description following gold standard tooltip format (What/When/Format/How/Important/Example sections)"
          },
          "citations": {
            "type": "array",
            "description": "Documentation references for this parameter",
            "items": {
              "type": "object",
              "required": ["docId", "docTitle", "sectionHeading", "url"],
              "properties": {
                "docId": {
                  "type": "string",
                  "description": "Document identifier slug",
                  "examples": ["installation-config-parameters-agent", "bare-metal-ipi"]
                },
                "docTitle": {
                  "type": "string",
                  "description": "Full document title"
                },
                "sectionHeading": {
                  "type": "string",
                  "description": "Section or heading within document"
                },
                "url": {
                  "type": "string",
                  "format": "uri",
                  "description": "Full URL to documentation page"
                }
              }
            }
          },
          "applies_to": {
            "type": "array",
            "description": "Optional list of scenario IDs this parameter applies to. If omitted, applies to current scenario only.",
            "items": { "type": "string" },
            "examples": [["bare-metal-ipi", "bare-metal-agent"], ["all"]]
          },
          "conditionals": {
            "type": "object",
            "description": "Optional conditional logic (mutual exclusivity, visibility constraints)",
            "properties": {
              "mutuallyExclusive": {
                "type": "array",
                "items": { "type": "string" },
                "description": "List of parameter paths that cannot coexist with this parameter"
              },
              "visibleWhen": {
                "type": "object",
                "description": "Conditions under which this parameter should be visible in UI"
              }
            }
          },
          "deprecated": {
            "type": "boolean",
            "description": "Marks parameter as deprecated. Shows orange 'Deprecated' badge in UI, adds warning to tooltip.",
            "default": false
          },
          "deprecatedReason": {
            "type": "string",
            "description": "Brief explanation of why parameter is deprecated and what to use instead. Shown in UI warning tooltip.",
            "examples": [
              "Legacy single-zone field. Use failureDomains for multi-zone support.",
              "Use imageDigestSources for IDMS-based mirroring instead of ICSP."
            ]
          },
          "replacementPath": {
            "type": "string",
            "description": "Canonical parameter path that replaces this deprecated field. Shown in UI tooltip as migration guidance.",
            "examples": [
              "platform.vsphere.failureDomains[].topology.datacenter",
              "imageDigestSources"
            ]
          },
          "removalVersion": {
            "type": "string",
            "description": "OpenShift major version when this field will be removed (e.g., '5.0'). Helps users plan migration timeline.",
            "pattern": "^\\d+\\.\\d+$",
            "examples": ["5.0", "6.0"]
          },
          "supportStatus": {
            "type": "string",
            "description": "⭐ NEW v2.0.0 REQUIRED: Support status taxonomy for version-awareness. MUST be present. CI fails on 'unknown-needs-review'.",
            "enum": [
              "supported-ui",
              "supported-backend-only",
              "supported-derived",
              "docs-only-not-supported",
              "hidden-not-applicable",
              "deprecated-supported",
              "removed"
            ],
            "examples": ["supported-ui", "supported-backend-only", "deprecated-supported"]
          },
          "minVersion": {
            "type": "string",
            "description": "⭐ NEW v2.0.0 REQUIRED: Minimum OpenShift minor version supporting this parameter (inclusive). Minor-version gate (includes all patches: 4.20.0, 4.20.15, etc.)",
            "pattern": "^4\\.\\d+$",
            "examples": ["4.20", "4.21", "4.22"],
            "default": "4.20"
          },
          "maxVersion": {
            "description": "⭐ NEW v2.0.0 REQUIRED: Maximum OpenShift minor version supporting this parameter (inclusive of all patches). Null means no maximum (ongoing support). Minor-version gate: maxVersion '4.21' includes 4.21.0 through 4.21.99 but EXCLUDES 4.22.0.",
            "oneOf": [
              { "type": "string", "pattern": "^4\\.\\d+$" },
              { "type": "null" }
            ],
            "examples": ["4.21", "4.22", null],
            "default": null
          },
          "versionNotes": {
            "type": "string",
            "description": "⭐ NEW v2.0.0: Version-specific notes for this parameter. Documents behavior changes, new defaults, or deprecation timeline across OpenShift versions.",
            "examples": [
              "Default changed from 100 to 120 in 4.21",
              "Required in 4.20, optional in 4.21+",
              "Deprecated in 4.20, removed in 4.22"
            ]
          },
          "validationRules": {
            "type": "object",
            "description": "⭐ NEW v2.0.0: Sparse version-specific validation rules. Keys are minor versions ('4.20', '4.21'). Rules inherit from previous versions unless overridden. Used for metadata-driven validation (90%) alongside function-based validators (10%).",
            "patternProperties": {
              "^4\\.\\d+$": {
                "type": "object",
                "description": "Validation rules for specific OpenShift minor version",
                "properties": {
                  "required": {
                    "type": "boolean",
                    "description": "Override global required field for this version"
                  },
                  "allowed": {
                    "oneOf": [
                      {
                        "type": "array",
                        "items": { "type": "string" },
                        "description": "Allowed enum values for this version"
                      },
                      {
                        "type": "string",
                        "description": "Free-form allowed description"
                      }
                    ]
                  },
                  "default": {
                    "description": "Version-specific default value",
                    "oneOf": [
                      { "type": "string" },
                      { "type": "number" },
                      { "type": "boolean" },
                      { "type": "null" }
                    ]
                  }
                }
              }
            },
            "examples": [
              {
                "4.20": { "allowed": ["OVNKubernetes", "OpenShiftSDN"] },
                "4.21": { "allowed": ["OVNKubernetes"] }
              },
              {
                "4.20": { "default": 100 },
                "4.21": { "default": 120 }
              }
            ]
          }
        },
        "if": {
          "properties": { "deprecated": { "const": true } }
        },
        "then": {
          "required": ["deprecatedReason", "replacementPath"]
        },
        "allOf": [
          {
            "if": {
              "properties": { "supportStatus": { "const": "unknown-needs-review" } }
            },
            "then": {
              "not": {}
            },
            "else": {}
          }
        ]
      }
    }
  },
  "examples": [
    {
      "scenarioId": "vsphere-ipi",
      "version": "4.20",
      "parameters": [
        {
          "path": "baseDomain",
          "outputFile": "install-config.yaml",
          "type": "string",
          "allowed": [],
          "default": null,
          "required": true,
          "description": "Base DNS domain for the cluster.",
          "supportStatus": "supported-ui",
          "minVersion": "4.20",
          "maxVersion": null,
          "citations": [
            {
              "docId": "installation-config-parameters",
              "docTitle": "Installation configuration parameters",
              "sectionHeading": "Required configuration parameters",
              "url": "https://docs.redhat.com/en/documentation/openshift_container_platform/4.20/html/installing/installation-configuration#installation-configuration-parameters"
            }
          ]
        },
        {
          "path": "networking.networkType",
          "outputFile": "install-config.yaml",
          "type": "string",
          "allowed": ["OVNKubernetes", "OpenShiftSDN"],
          "default": "OVNKubernetes",
          "required": false,
          "description": "Network plugin for the cluster network.",
          "supportStatus": "supported-ui",
          "minVersion": "4.20",
          "maxVersion": null,
          "versionNotes": "OpenShiftSDN deprecated in 4.20, removed in 4.21",
          "validationRules": {
            "4.20": { "allowed": ["OVNKubernetes", "OpenShiftSDN"] },
            "4.21": { "allowed": ["OVNKubernetes"] }
          },
          "citations": []
        },
        {
          "path": "platform.vsphere.datacenter",
          "outputFile": "install-config.yaml",
          "type": "string",
          "allowed": [],
          "default": null,
          "required": false,
          "description": "⚠️ DEPRECATED: Legacy single-zone vSphere datacenter name. Use failureDomains[].topology.datacenter for multi-zone deployments.",
          "deprecated": true,
          "deprecatedReason": "Legacy single-zone field. Use failureDomains for multi-zone support.",
          "replacementPath": "platform.vsphere.failureDomains[].topology.datacenter",
          "removalVersion": "5.0",
          "supportStatus": "deprecated-supported",
          "minVersion": "4.18",
          "maxVersion": "4.21",
          "versionNotes": "Deprecated in 4.20, will be removed in 5.0",
          "citations": [
            {
              "docId": "vsphere-installation-config",
              "docTitle": "vSphere installation configuration",
              "sectionHeading": "Platform configuration",
              "url": "https://docs.redhat.com/..."
            }
          ]
        }
      ]
    }
  ],
  "notes": [
    "This schema documents the structure of parameter catalog files used by the OpenShift Airgap Architect application.",
    "Catalog files are located in data/params/4.20/ (backend) and synchronized to frontend/src/data/catalogs/.",
    "The 'deprecated' family of fields (v1.1.0) enables gradual migration from legacy fields to canonical replacements.",
    "⭐ v2.0.0 BREAKING CHANGE: All parameters MUST have 'supportStatus', 'minVersion', and 'maxVersion' fields (REQUIRED). CI validation FAILS on 'unknown-needs-review' status.",
    "⭐ v2.0.0: minVersion and maxVersion are MINOR-VERSION gates. Phase 0 added explicit values to all 1,071 parameters.",
    "⭐ v2.0.0: Minor-version gate semantics: maxVersion '4.21' includes 4.21.0, 4.21.15 but excludes 4.22.0.",
    "⭐ v2.0.0: validationRules (OPTIONAL) enables sparse version-specific validation with inheritance from prior versions.",
    "UI components (FieldLabelWithInfo) render deprecated parameters with orange badges and warning tooltips.",
    "Backend validation (yamlValidator.js) logs warnings when deprecated fields are used in generated YAML.",
    "Deprecation follows OpenShift semantic versioning: deprecate in minor version (4.20), remove in major version (5.0+)."
  ]
}
