{
  "version": "4.20",
  "scenarioId": "oc-mirror-v2",
  "description": "ImageSetConfiguration parameters for oc-mirror v2 - disconnected image mirroring to registries",
  "parameters": [
    {
      "path": "apiVersion",
      "outputFile": "imageset-config.yaml",
      "type": "string",
      "allowed": "mirror.openshift.io/v2alpha1",
      "default": "mirror.openshift.io/v2alpha1",
      "required": true,
      "description": "The API version of the ImageSetConfiguration content. Must be mirror.openshift.io/v2alpha1 for oc-mirror v2.",
      "applies_to": [
        "oc-mirror-v2"
      ],
      "citations": [
        {
          "docId": "disconnected-environments-imageset-params",
          "docTitle": "ImageSet Configuration Parameters for oc-mirror Plugin v2",
          "sectionHeading": "5.12. ImageSet configuration parameters for oc-mirror plugin v2",
          "url": "https://docs.redhat.com/en/documentation/openshift_container_platform/4.20/html/disconnected_environments/mirroring-images-for-a-disconnected-installation-using-the-oc-mirror-plugin-v2#oc-mirror-imageset-config-params_oc-mirror-v2"
        }
      ],
      "supportStatus": "supported-backend-only",
      "minVersion": "4.20",
      "maxVersion": null
    },
    {
      "path": "kind",
      "outputFile": "imageset-config.yaml",
      "type": "string",
      "allowed": "ImageSetConfiguration",
      "default": "ImageSetConfiguration",
      "required": true,
      "description": "The resource kind. Must be ImageSetConfiguration for oc-mirror v2 image set configuration files.",
      "applies_to": [
        "oc-mirror-v2"
      ],
      "citations": [
        {
          "docId": "disconnected-environments-imageset-params",
          "docTitle": "ImageSet Configuration Parameters for oc-mirror Plugin v2",
          "sectionHeading": "5.12. ImageSet configuration parameters for oc-mirror plugin v2",
          "url": "https://docs.redhat.com/en/documentation/openshift_container_platform/4.20/html/disconnected_environments/mirroring-images-for-a-disconnected-installation-using-the-oc-mirror-plugin-v2#oc-mirror-imageset-config-params_oc-mirror-v2"
        }
      ],
      "supportStatus": "supported-backend-only",
      "minVersion": "4.20",
      "maxVersion": null
    },
    {
      "path": "archiveSize",
      "outputFile": "imageset-config.yaml",
      "type": "integer",
      "allowed": "Integer (GiB)",
      "default": "not specified in docs",
      "required": false,
      "description": "The maximum size, in GiB, of each archive file within the image set. Used for mirror-to-disk workflow to split large image sets into multiple archive files.",
      "applies_to": [
        "oc-mirror-v2"
      ],
      "citations": [
        {
          "docId": "disconnected-environments-imageset-params",
          "docTitle": "ImageSet Configuration Parameters for oc-mirror Plugin v2",
          "sectionHeading": "Table 5.3. ImageSetConfiguration parameters",
          "url": "https://docs.redhat.com/en/documentation/openshift_container_platform/4.20/html/disconnected_environments/mirroring-images-for-a-disconnected-installation-using-the-oc-mirror-plugin-v2#oc-mirror-imageset-config-params_oc-mirror-v2"
        }
      ],
      "supportStatus": "supported-backend-only",
      "minVersion": "4.20",
      "maxVersion": null
    },
    {
      "path": "kubeVirtContainer",
      "outputFile": "imageset-config.yaml",
      "type": "boolean",
      "allowed": [
        "true",
        "false"
      ],
      "default": "false",
      "required": false,
      "description": "When set to true, includes images from the HyperShift KubeVirt CoreOS container. Used for HyperShift deployments with KubeVirt provider.",
      "applies_to": [
        "oc-mirror-v2"
      ],
      "citations": [
        {
          "docId": "disconnected-environments-imageset-params",
          "docTitle": "ImageSet Configuration Parameters for oc-mirror Plugin v2",
          "sectionHeading": "Table 5.3. ImageSetConfiguration parameters",
          "url": "https://docs.redhat.com/en/documentation/openshift_container_platform/4.20/html/disconnected_environments/mirroring-images-for-a-disconnected-installation-using-the-oc-mirror-plugin-v2#oc-mirror-imageset-config-params_oc-mirror-v2"
        }
      ],
      "supportStatus": "supported-backend-only",
      "minVersion": "4.20",
      "maxVersion": null
    },
    {
      "path": "mirror",
      "outputFile": "imageset-config.yaml",
      "type": "object",
      "allowed": "Object containing platform, operators, helm, additionalImages, blockedImages",
      "default": "not specified in docs",
      "required": true,
      "description": "The main configuration object for the image set. Contains nested configuration for platform releases, operators, helm charts, and additional images to mirror.",
      "applies_to": [
        "oc-mirror-v2"
      ],
      "citations": [
        {
          "docId": "disconnected-environments-imageset-params",
          "docTitle": "ImageSet Configuration Parameters for oc-mirror Plugin v2",
          "sectionHeading": "Table 5.3. ImageSetConfiguration parameters",
          "url": "https://docs.redhat.com/en/documentation/openshift_container_platform/4.20/html/disconnected_environments/mirroring-images-for-a-disconnected-installation-using-the-oc-mirror-plugin-v2#oc-mirror-imageset-config-params_oc-mirror-v2"
        }
      ],
      "supportStatus": "supported-backend-only",
      "minVersion": "4.20",
      "maxVersion": null
    },
    {
      "path": "mirror.additionalImages",
      "outputFile": "imageset-config.yaml",
      "type": "array",
      "allowed": "Array of objects with 'name' field",
      "default": "not specified in docs",
      "required": false,
      "description": "Additional container images to include in the image set beyond platform and operator images. Each entry specifies an image by tag or digest. In oc-mirror v2, you must use explicit registry hostnames.",
      "applies_to": [
        "oc-mirror-v2"
      ],
      "citations": [
        {
          "docId": "disconnected-environments-imageset-params",
          "docTitle": "ImageSet Configuration Parameters for oc-mirror Plugin v2",
          "sectionHeading": "Table 5.3. ImageSetConfiguration parameters",
          "url": "https://docs.redhat.com/en/documentation/openshift_container_platform/4.20/html/disconnected_environments/mirroring-images-for-a-disconnected-installation-using-the-oc-mirror-plugin-v2#oc-mirror-imageset-config-params_oc-mirror-v2"
        }
      ],
      "supportStatus": "supported-backend-only",
      "minVersion": "4.20",
      "maxVersion": null
    },
    {
      "path": "mirror.additionalImages[].name",
      "outputFile": "imageset-config.yaml",
      "type": "string",
      "allowed": "Container image reference (tag or digest)",
      "default": "not specified in docs",
      "required": false,
      "description": "The tag or digest of the additional image to mirror. Examples: registry.redhat.io/ubi8/ubi:latest or quay.io/app@sha256:abc123...",
      "applies_to": [
        "oc-mirror-v2"
      ],
      "citations": [
        {
          "docId": "disconnected-environments-imageset-params",
          "docTitle": "ImageSet Configuration Parameters for oc-mirror Plugin v2",
          "sectionHeading": "Table 5.3. ImageSetConfiguration parameters",
          "url": "https://docs.redhat.com/en/documentation/openshift_container_platform/4.20/html/disconnected_environments/mirroring-images-for-a-disconnected-installation-using-the-oc-mirror-plugin-v2#oc-mirror-imageset-config-params_oc-mirror-v2"
        }
      ],
      "supportStatus": "supported-backend-only",
      "minVersion": "4.20",
      "maxVersion": null
    },
    {
      "path": "mirror.blockedImages",
      "outputFile": "imageset-config.yaml",
      "type": "array",
      "allowed": "Array of strings (image references)",
      "default": "not specified in docs",
      "required": false,
      "description": "List of images with a tag or digest to block from mirroring. Can specify full image references or patterns to exclude unwanted images from the mirror operation.",
      "applies_to": [
        "oc-mirror-v2"
      ],
      "citations": [
        {
          "docId": "disconnected-environments-imageset-params",
          "docTitle": "ImageSet Configuration Parameters for oc-mirror Plugin v2",
          "sectionHeading": "Table 5.3. ImageSetConfiguration parameters",
          "url": "https://docs.redhat.com/en/documentation/openshift_container_platform/4.20/html/disconnected_environments/mirroring-images-for-a-disconnected-installation-using-the-oc-mirror-plugin-v2#oc-mirror-imageset-config-params_oc-mirror-v2"
        }
      ],
      "supportStatus": "supported-backend-only",
      "minVersion": "4.20",
      "maxVersion": null
    },
    {
      "path": "mirror.helm",
      "outputFile": "imageset-config.yaml",
      "type": "object",
      "allowed": "Object with 'local' and 'repositories' fields",
      "default": "not specified in docs",
      "required": false,
      "description": "The helm configuration for the image set. Allows mirroring helm charts from local paths or remote repositories. Note: oc-mirror does not support helm charts with manually modified values.yaml files.",
      "applies_to": [
        "oc-mirror-v2"
      ],
      "citations": [
        {
          "docId": "disconnected-environments-imageset-params",
          "docTitle": "ImageSet Configuration Parameters for oc-mirror Plugin v2",
          "sectionHeading": "Table 5.3. ImageSetConfiguration parameters",
          "url": "https://docs.redhat.com/en/documentation/openshift_container_platform/4.20/html/disconnected_environments/mirroring-images-for-a-disconnected-installation-using-the-oc-mirror-plugin-v2#oc-mirror-imageset-config-params_oc-mirror-v2"
        }
      ],
      "supportStatus": "supported-backend-only",
      "minVersion": "4.20",